{
  "schemaVersion": 1,
  "created": "2026-08-16T00:00:00Z",
  "policy": "Own Sakura Editor NEXT critical runtime sources so product behavior is not gated on an external project's maintenance, release cadence, or build system.",
  "dependencies": [
    {
      "id": "onigmo-next",
      "kind": "library",
      "ownership": "external",
      "lifecycle": "temporary-migration",
      "status": "present",
      "scope": ["restore", "build", "runtime"],
      "owner": "search",
      "plannedEndState": "owned-snapshot",
      "plannedIssue": 185,
      "canonicalRepository": "https://github.com/tsuyoshi-otake/onigmo-next.git",
      "source": "externals/onigmo-next",
      "sourceRevision": "e96f322d0486f49d913abd21703e7eec6e572412",
      "maintainerCheckout": "externals/onigmo-next",
      "vcpkg": "onigmo-next",
      "license": "BSD-2-Clause",
      "version": "6.2.0",
      "updatePolicy": "import-owned-snapshot-then-stop-using-the-submodule",
      "localModificationAllowed": false,
      "productBuildUsesSubmodule": true,
      "includePatterns": [
        {
          "pattern": "onigmo-next/onigmo.h",
          "roots": ["sakura_core"]
        }
      ]
    },
    {
      "id": "bregonig-next",
      "kind": "library",
      "ownership": "external",
      "lifecycle": "temporary-migration",
      "status": "present",
      "scope": ["restore", "build", "runtime", "distribution"],
      "owner": "search",
      "plannedEndState": "owned-snapshot",
      "plannedIssue": 185,
      "canonicalRepository": "https://github.com/k-takata/bregonig.git",
      "source": "externals/bregonig",
      "sourceRevision": "670b229063a33910e717a9f220d89ce8ab46d790",
      "maintainerCheckout": "externals/bregonig",
      "vcpkg": "bregonig",
      "license": "GPL-1.0-or-later OR Artistic-1.0-Perl",
      "version": "4.20.0",
      "updatePolicy": "import-owned-snapshot-then-stop-using-the-submodule",
      "runtimeIsolation": "LoadLibrary bregonig.dll; native static retirement is #190",
      "localModificationAllowed": false,
      "productBuildUsesSubmodule": true,
      "runtimeArtifacts": [
        {
          "name": "bregonig.dll",
          "provider": "vcpkg-imported-target",
          "productProvider": true
        }
      ]
    },
    {
      "id": "cmigemo-next",
      "kind": "library",
      "ownership": "external",
      "lifecycle": "temporary-migration",
      "status": "present",
      "scope": ["restore", "build", "runtime", "distribution"],
      "owner": "search",
      "plannedEndState": "owned-snapshot",
      "plannedIssue": 186,
      "canonicalRepository": "https://github.com/koron/cmigemo.git",
      "source": "externals/cmigemo",
      "sourceRevision": "e0f6145f61e0b7058c3006f344e58571d9fdd83a",
      "maintainerCheckout": "externals/cmigemo",
      "vcpkg": "cmigemo",
      "license": "MIT",
      "version": "1.3e",
      "updatePolicy": "goldenize-1.3e-then-migrate-cmigemo-next-to-v1.6.1",
      "runtimeIsolation": "LoadLibrary migemo.dll; native static retirement is #190",
      "localModificationAllowed": false,
      "productBuildUsesSubmodule": true,
      "includePatterns": [
        {
          "pattern": "cmigemo/migemo.h",
          "roots": ["sakura_core"]
        }
      ],
      "runtimeArtifacts": [
        {
          "name": "migemo.dll",
          "provider": "vcpkg-imported-target",
          "productProvider": true
        }
      ]
    },
    {
      "id": "cmigemo-dict",
      "kind": "data",
      "ownership": "external",
      "lifecycle": "keep",
      "status": "present",
      "scope": ["restore", "runtime", "distribution"],
      "owner": "search",
      "plannedIssue": 186,
      "canonicalRepository": "https://github.com/koron/cmigemo",
      "source": "externals/cmigemo-dict",
      "license": "GPL-2.0-or-later",
      "updatePolicy": "hash-pinned-dictionary-zips-separate-from-cmigemo-code",
      "notes": "GPL dictionary zips are a separate artifact from the MIT C/Migemo code.",
      "artifacts": [
        {
          "path": "externals/cmigemo-dict/cmigemo-dict-cp932.zip",
          "sha256": "1aa0e7eb388e68a4b0abea213a74291f17c605a69dac4f51b46f8463f0f7f39b",
          "bytes": 1504142,
          "productProvider": false
        },
        {
          "path": "externals/cmigemo-dict/cmigemo-dict-utf-8.zip",
          "sha256": "969515a4043043c25b8ce5d86642880c5902180039e8c9a7a538787da1a30c6c",
          "bytes": 1689055,
          "productProvider": false
        }
      ]
    },
    {
      "id": "darkmodelib",
      "kind": "library",
      "ownership": "external",
      "lifecycle": "temporary-migration",
      "status": "present",
      "scope": ["restore", "build", "runtime"],
      "owner": "theme",
      "plannedEndState": "owned-implementation",
      "plannedIssue": 188,
      "canonicalRepository": "https://github.com/ozone10/darkmodelib.git",
      "source": "externals/darkmodelib",
      "sourceRevision": "f7847b514a67f3bf051beda58bcf7d05b3ace564",
      "maintainerCheckout": "externals/darkmodelib",
      "vcpkg": "darkmodelib",
      "license": "MPL-2.0 AND MIT",
      "version": "0.48.0",
      "updatePolicy": "bind-then-replace-Win32-surfaces-before-deleting-the-library",
      "localModificationAllowed": false,
      "productBuildUsesSubmodule": true,
      "notes": "Do not copy MPL code into Sakura-owned files. Theme replacement is #188.",
      "includePatterns": [
        {
          "pattern": "DarkModeSubclass.h",
          "roots": ["sakura_core"]
        }
      ]
    },
    {
      "id": "picojson",
      "kind": "library",
      "ownership": "external",
      "lifecycle": "temporary-migration",
      "status": "present",
      "scope": ["build", "runtime"],
      "owner": "serialization",
      "plannedEndState": "owned-implementation",
      "plannedIssue": 187,
      "canonicalRepository": "https://github.com/kazuho/picojson.git",
      "source": "externals/picojson",
      "sourceRevision": "111c9be5188f7350c2eac9ddaedd8cca3d7bf394",
      "maintainerCheckout": "externals/picojson",
      "license": "BSD-2-Clause",
      "updatePolicy": "replace-with-bounded-Sakura-JSON-then-delete-the-submodule",
      "localModificationAllowed": false,
      "productBuildUsesSubmodule": true,
      "includePatterns": [
        {
          "pattern": "picojson/picojson.h",
          "roots": ["sakura_core"]
        }
      ]
    },
    {
      "id": "fmt",
      "kind": "library",
      "ownership": "external",
      "lifecycle": "remove",
      "status": "present",
      "scope": ["restore", "build", "runtime"],
      "owner": "terminal",
      "plannedIssue": 189,
      "vcpkg": "fmt",
      "license": "MIT",
      "updatePolicy": "Windows-Terminal-vendor-only-then-drop-from-vcpkg.json",
      "notes": "Product code uses std::format. fmt remains only for sakura_core/terminal/vendor/.",
      "includePatterns": [
        {
          "pattern": "fmt/",
          "roots": ["sakura_core/terminal/vendor/"]
        }
      ]
    },
    {
      "id": "ms-gsl",
      "kind": "library",
      "ownership": "external",
      "lifecycle": "remove",
      "status": "present",
      "scope": ["restore", "build", "runtime"],
      "owner": "terminal",
      "plannedIssue": 189,
      "vcpkg": "ms-gsl",
      "license": "MIT",
      "updatePolicy": "Windows-Terminal-vendor-only-then-drop-from-vcpkg.json",
      "notes": "Product code uses std::span. ms-gsl remains only for sakura_core/terminal/vendor/.",
      "includePatterns": [
        {
          "pattern": "gsl/",
          "roots": ["sakura_core/terminal/vendor/"]
        }
      ]
    },
    {
      "id": "wil",
      "kind": "library",
      "ownership": "external",
      "lifecycle": "remove",
      "status": "present",
      "scope": ["restore", "build", "runtime"],
      "owner": "terminal",
      "plannedIssue": 189,
      "vcpkg": "wil",
      "license": "MIT",
      "updatePolicy": "Windows-Terminal-vendor-only-then-drop-from-vcpkg.json",
      "notes": "Do not fork WIL. It remains only for sakura_core/terminal/vendor/.",
      "includePatterns": [
        {
          "pattern": "wil/",
          "roots": ["sakura_core/terminal/vendor/"]
        }
      ]
    },
    {
      "id": "windows-terminal-vendor",
      "kind": "library",
      "ownership": "owned-snapshot",
      "lifecycle": "temporary-migration",
      "status": "present",
      "scope": ["build", "runtime"],
      "owner": "terminal",
      "plannedIssue": 189,
      "source": "sakura_core/terminal/vendor/windows_terminal",
      "license": "MIT",
      "updatePolicy": "keep-needed-Windows-Terminal-pieces-until-the-terminal-capability-is-owned",
      "localModificationAllowed": true,
      "notes": "In-tree selected snapshot, not third_party/owned. fmt, GSL, and WIL currently exist for this tree."
    },
    {
      "id": "bron420-zip",
      "kind": "data",
      "ownership": "external",
      "lifecycle": "temporary-migration",
      "status": "present",
      "scope": ["test"],
      "owner": "search",
      "plannedIssue": 185,
      "source": "installer/externals/bregonig/bron420.zip",
      "license": "GPL-1.0-or-later OR Artistic-1.0-Perl",
      "updatePolicy": "hash-pinned-test-only-oracle-deleted-after-bregonig-differential-golden",
      "notes": "Not a runtime provider. Packaging must not extract this archive into the product output.",
      "artifacts": [
        {
          "path": "installer/externals/bregonig/bron420.zip",
          "sha256": "15f58dd292aa6fc8fd592fa97a75d58b5680ddf7aa66ba10a2dd5c9f0ee159c1",
          "bytes": 537749,
          "productProvider": false
        }
      ]
    },
    {
      "id": "gtest",
      "kind": "library",
      "ownership": "external",
      "lifecycle": "keep",
      "status": "present",
      "scope": ["restore", "test"],
      "owner": "test",
      "vcpkg": "gtest",
      "license": "BSD-3-Clause",
      "updatePolicy": "vcpkg-test-only-never-a-product-submodule",